{
  "contract_version": "dir.v1",
  "phase": "pre_input",
  "decision_id": "dec_01HX8KF2Q3MDE5WG3MRG07",
  "execution_id": "exe_01HX8KF2Q3MDE5WG3MRG07",
  "issued_at": "2026-04-20T12:47:44.812Z",
  "rules_fired": [
    "dir_safety_relevant_confirmation",
    "dir_auto_safety_tool_lockdown",
    "dir_drift_coaching_inline",
    "dir_gdpr_pii_minimisation"
  ],
  "additional_instructions": [
    "This task is safety-relevant. Cite manufacturer service bulletins for every recommendation and flag any action requiring human sign-off before execution.",
    "Automotive safety controls are locked down. You may diagnose but must not invoke any tool that mutates vehicle state without a human-in-the-loop approval.",
    "Skill drift risk for this capability is elevated (drift_risk > 0.35). Emit the chain-of-checks: state assumption, cite source, declare confidence, and name the fallback action if confidence is below 0.6.",
    "Mask direct identifiers (email, phone, national ID, precise geolocation) in any output. Reference data subjects by their pseudonymous token only."
  ],
  "restricted_tools": [
    "clear_dtc_without_root_cause",
    "ota_push_untested",
    "disable_adas_module",
    "full_profile_lookup",
    "cross_tenant_join"
  ],
  "required_tools": ["pii_redactor"],
  "required_citations": true,
  "require_human_confirmation": true,
  "safety_envelope": "gdpr_standard_v1",
  "metadata": {
    "pack_id": "merged",
    "ttl_seconds": 900,
    "note": "safety_envelope resolved by last-non-null-wins; registration order matters."
  }
}
