{
  "contract_version": "dir.v1",
  "phase": "pre_input",
  "decision_id": "dec_01HX8KF2Q3MDE5WG3AUTO2",
  "execution_id": "exe_01HX8KF2Q3MDE5WG3AUTO2",
  "issued_at": "2026-04-20T12:42:01.100Z",
  "rules_fired": ["dir_auto_safety_tool_lockdown"],
  "additional_instructions": [
    "Automotive safety controls are locked down. You may diagnose but must not invoke any tool that mutates vehicle state without a human-in-the-loop approval."
  ],
  "restricted_tools": [
    "clear_dtc_without_root_cause",
    "ota_push_untested",
    "disable_adas_module"
  ],
  "required_tools": [],
  "required_citations": true,
  "require_human_confirmation": true,
  "safety_envelope": "auto_safety_lockdown_v1",
  "metadata": {
    "pack_id": "auto_safety_standard",
    "ttl_seconds": 3600
  }
}
